timestamp,job_id,job_title,company,location,experience_years,salary,comment,job_url
2026-02-14 14:23 UTC,4321074624,"Sr/Principal Product Manager, 3D Generation",Roblox,"San Mateo, CA (Hybrid)",Not specified,$260.9K/yr - $329.3K/yr,"Rating: Medium

The candidate presents a strong AI Product Management background with impressive technical skills (MS CS AI, LLM fine-tuning, evaluation) and a track record of shipping impactful AI products. This aligns well with the Foundation AI group's core mission. However, a significant gap is the explicit requirement for ""proven experience in building, shipping or supporting 3D content creation tools or pipelines."" The resume lacks any mention of 3D generation, gaming, or creator tools, which is central to this specific Roblox role focused on 3D/4D generation.",https://www.linkedin.com/jobs/view/4321074624/
2026-02-14 14:23 UTC,4370998615,Digital Product Manager,Amgen,United States (Remote),Not specified,Not listed,"Rating: High

Analysis: This is an excellent match. Yi's 5+ years of Product Management experience and dual Master's degrees significantly exceed the job's basic requirements. Her deep AI/ML product expertise, particularly with LLMs in healthcare (Commure, ChatGeneT), aligns perfectly with Amgen's mission and ""Sensing capabilities."" Strong quantitative results and full product lifecycle ownership are key strengths. The primary concern is the relatively short tenure at Commure.",https://www.linkedin.com/jobs/view/4370998615/
2026-02-14 14:23 UTC,4346956870,Senior Product Manager - X Stream,Uniphore,"Palo Alto, CA",5+ years,$186.9K/yr - $257K/yr,"Rating: High

This is a High match. Emma's resume demonstrates exceptional alignment with the core technical requirements: LLM fine-tuning, human-in-the-loop (RLHF) workflows, model evaluation, and building end-to-end AI pipelines in enterprise contexts. Her MS in CS (AI) and hands-on skills provide deep technical credibility. While total PM experience is on the lower end for ""Senior,"" her specialized AI product expertise, including multimodal experience, is highly relevant. Explicit ML-Ops platform ownership is a minor potential gap.",https://www.linkedin.com/jobs/view/4346956870/
2026-02-14 14:23 UTC,4365612707,Product Manager I (Fintech),Housecall Pro,United States (Remote),2+ years,$96K/yr - $120K/yr,"Rating: High

This is a strong match due to the candidate's deep AI/ML product management expertise and significant Fintech experience from JPMorgan and Société Générale, directly aligning with the job title. They consistently deliver quantifiable business impact across various products. While potentially overqualified for a typical ""PM I"" role, their specialized AI and finance skills are highly relevant. A minor gap is direct domain experience in home services, but core product and technical acumen are excellent.",https://www.linkedin.com/jobs/view/4365612707/
2026-02-14 14:23 UTC,4329868807,"Product Manager, Claude Code (Enterprise)",Anthropic,"San Francisco, CA (Hybrid)",5+ years,$285K/yr - $305K/yr,"Rating: High

This candidate is an exceptional match. They exceed the 5+ years PM experience, demonstrating a strong track record of launching and scaling technical AI products for enterprise customers with significant commercial success. Their deep technical AI/ML background, including LLM fine-tuning, AI pipelines, and relevant skills (Python, SQL, PyTorch, LangChain), aligns perfectly. A slight gap is the lack of explicit ""developer tools PM"" experience, and the future-dated projects are unusual but highlight strong AI engagement.",https://www.linkedin.com/jobs/view/4329868807/
2026-02-14 14:23 UTC,4373225158,Product Manager,Haystack,United States (Remote),3+ years,"$161,000 - $271,000","Rating: High

This is a High match. The candidate possesses excellent AI/ML product management experience (LLMs, enterprise platforms) within B2B SaaS, evidenced by impressive quantifiable results across healthcare and finance. Their 5+ years of PM experience, deep analytics skills, and AI expertise directly align. While direct ""AIOps"" domain experience isn't explicitly stated, their foundational AI-driven efficiency and automation work is highly relevant. Minor gaps include explicit API-first development examples or specific ITOps domain knowledge, but these are outweighed by core strengths.",https://www.linkedin.com/jobs/view/4373225158/
2026-02-14 14:23 UTC,4373206934,Product Manager (Remote),Jobgether,"California, United States (Remote)",5+ years,Not listed,"Rating: Low

This is a low match due to critical domain-specific gaps. While the candidate boasts strong AI Product Management experience (5+ years) and impressive technical/analytical skills with some healthcare AI exposure, they lack the explicit Bachelor’s degree in Life Sciences and direct experience in NGS, molecular diagnostics, LDTs, or sequencing services, which are core requirements. The AI/enterprise experience is highly relevant to product *management* but not the *specific biopharma diagnostic domain*.",https://www.linkedin.com/jobs/view/4373206934/
2026-02-14 15:34 UTC,4349735338,"Senior PR Manager, Product",CoreWeave,"Sunnyvale, CA",8-12 years,$135K/yr - $198K/yr,"Rating: Low

Analysis: This candidate possesses strong AI/ML product management expertise (~5 years) with a deep technical understanding relevant to AI infrastructure. They excel in translating complex technical concepts into business outcomes. However, the role is for a *Senior Product PR Manager* requiring 8-12+ years in *PR/Communications*, media strategy, and reporter relationships—skills entirely absent from the candidate's resume. While their AI domain knowledge is a strong asset, the core functional experience for a PR role is missing.",https://www.linkedin.com/jobs/view/4349735338/
2026-02-14 15:34 UTC,4332749222,"Sr. Product Manager, AWS Server Supply Chain",Amazon Web Services (AWS),"Cupertino, CA",5+ years,$133.2K/yr - $220.2K/yr,"Rating: Low

The candidate is a strong AI Product Manager with an impressive track record and results-driven approach. However, this AWS role is highly specialized in physical hardware supply chain, PCB manufacturing, and semiconductor operations—a domain where the candidate lacks direct experience. Their extensive AI/ML product background, while valuable, doesn't align with the core responsibilities of managing infrastructure supply chains and supplier agreements for servers.",https://www.linkedin.com/jobs/view/4332749222/
2026-02-14 15:34 UTC,4365602333,"Research & Development Manager, Industrial",Calumet,United States (Remote),5+ years,Not listed,"Rating: Low

This is a very poor match. The candidate's extensive experience is in AI/software product management within the finance and healthcare sectors, which is entirely unrelated to the core requirements of an R&D Manager for industrial lubricants and greases. She lacks the foundational chemical engineering/chemistry background, 5+ years of lubricant formulation experience, and knowledge of specific industry standards (ASTM, OEM). While her project leadership and product development lifecycle experience are strong, they are not transferable to this highly specialized technical domain.",https://www.linkedin.com/jobs/view/4365602333/
2026-02-14 15:34 UTC,4355347595,Technical Product Marketing Manager,FastSpring,United States (Remote),5+ years,$120K/yr - $135K/yr,"Rating: Medium-High

This candidate is a strong technical product leader with exceptional AI/ML experience, quantitative skills, and a proven track record of driving significant business impact. While lacking direct product marketing titles, their strategic product and GTM experience, coupled with deep technical acumen, makes them a compelling fit for the ""developer who loves marketing"" aspect of this hybrid role. Key strengths include outstanding technical depth, quantifiable business results, and strategic product management. Gaps include limited explicit product marketing experience (external messaging) and specific HTML/CSS/JS skills for POCs are not listed.",https://www.linkedin.com/jobs/view/4355347595/
2026-02-14 15:34 UTC,4343376798,Technical Product Manager - Risk,Sardine,United States (Remote),7+ years,$145,"Rating: Medium

Yi has strong AI/ML product experience, excelling in LLM fine-tuning, building AI pipelines, and delivering quantifiable impact in finance and enterprise platforms. This is highly relevant to Sardine's tech stack and mission. However, she falls short on the required 7+ years of total PM experience (has ~5 years) and lacks explicit, dedicated experience (4+ years) in financial crime fraud detection systems, typologies, and risk management, which are core to this specific role.",https://www.linkedin.com/jobs/view/4343376798/
2026-02-14 15:34 UTC,4338322247,Global Technical Product Manager - AXELIOS Sequencing System,Roche,"Santa Clara, CA",5+ years,"$109,300 - $203,100.00","Rating: High

Analysis: Emma is an excellent match. Her extensive AI/ML and enterprise PM experience, particularly in healthcare with quantifiable impact, aligns perfectly with shaping precision medicine. She demonstrates strong technical leadership and ability to bridge R&D and customer success. A minor gap might be less direct experience in hands-on L2 technical troubleshooting/support and specific hardware/medical device integration, but her technical depth makes her highly adaptable.

---
**Detailed Evaluation:**

1.  **Does the candidate's experience level meet the job requirements?**
    Yes, absolutely. Emma brings over 5 years of senior-level Product Management experience across multiple demanding industries (AI/healthcare, finance). The job description calls for someone who ""defines the work scope and works autonomously,"" ""serves as a technical expert,"" and ""Leads the overall GCS project team."" Her track record of leading complex AI initiatives, achieving significant business outcomes, and holding an MS in Computer Science (AI concentration) demonstrates the required leadership, technical depth, and autonomy.

2.  **How relevant is the candidate's AI/enterprise product experience to this role?**
    Highly relevant.
    *   **AI Experience:** The role is for a cutting-edge ""sequencing platform,"" which undoubtedly involves advanced data processing and potentially AI/ML for analysis in precision medicine. Emma's deep expertise in fine-tuning LLMs, building AI pipelines, prompt engineering, and ML-driven scoring is a significant asset. Her AI projects (ChatGeneT, Decoding the Beige Book) further showcase her advanced application of AI.
    *   **Enterprise Product Experience:** Her background at Commure (Enterprise AI, Series D Unicorn) and JPMorgan demonstrates experience with robust, scalable enterprise-grade platforms, which is crucial for Roche's ""AXELIOS System"" that needs to be ""robust, scalable, and user-centric.""

3.  **What are the candidate's strongest matching qualifications?**
    *   **Deep AI/ML Expertise:** Hands-on experience with LLM fine-tuning, pipeline building, and evaluation, directly applicable to advanced medical data analysis.
    *   **Healthcare Domain Experience:** Her role at Commure, involving CPT/ICD codes, medical necessity evidence, and scaling to healthcare organizations, is directly relevant to Roche's mission. The ChatGeneT project (AI ""Patient Simulator"" for hospitals) further reinforces this.
    *   **Quantifiable Impact:** Every role showcases impressive, measurable results (revenue increase, churn reduction, trading volume/profit increase, user growth, accuracy rates).
    *   **Technical Product Leadership:** Proven ability to lead product development from strategy to launch, influence design, and ensure technical readiness for complex platforms.
    *   **""Strategic Bridge"" Capability:** Her profile perfectly aligns with the job's core need for a ""strategic bridge between R&D Innovation and Global Customer Success.""

4.  **What gaps or weaknesses might the candidate have for this role?**
    *   **Direct Troubleshooting/Support Experience:** While highly technical, Emma's resume emphasizes building, optimizing, and leading product strategy rather than direct, hands-on L2/L3 troubleshooting, system escalations, or providing ""expert-level HW/SW support during 'rush hour' periods"" as a primary function of her previous roles. The job description leans heavily into this GCS (Global Customer Support) aspect.
    *   **Hardware/Medical Device Specifics:** Her healthcare experience is strong on the enterprise AI software/data side. The ""AXELIOS Sequencing System"" implies a sophisticated blend of hardware and software specific to a lab or medical device context. While her technical acumen is high, specific experience with the unique challenges of integrating and supporting physical medical devices or sequencing hardware isn't explicitly detailed.
    *   **Training and Documentation:** The role mentions creating/revising training curriculum and service manuals. While a PM often contributes to these, direct experience leading these activities isn't highlighted.",https://www.linkedin.com/jobs/view/4338322247/
2026-02-14 15:34 UTC,4323667251,"Sr. Product Manager, Onboarding & Safety",Twitch,"San Francisco, CA",8+ years,$136.1K/yr - $235.2K/yr,Error generating comment,https://www.linkedin.com/jobs/view/4323667251/
2026-02-14 16:39 UTC,4343278703,Product Analytics Manager,Blackhawk Network,"Pleasanton, CA (On-site)",8-10 years,$125.1K/yr - $212K/yr,"Rating: Medium

This candidate possesses exceptional data-driven product management experience and strong analytical skills (SQL, Python, BI tools, A/B testing) crucial for shaping product strategy and establishing metrics, with a proven track record of quantifiable impact. However, her core experience is as a Product Manager, not specifically building a Product Analytics practice from scratch. The heavy AI/LLM focus isn't directly relevant to Blackhawk's stated needs. Most critically, her ongoing MS in CS (AI concentration) from Sep 2024–Dec 2025 raises significant concerns about full-time availability and long-term commitment.",https://www.linkedin.com/jobs/view/4343278703/
2026-02-14 16:39 UTC,4333011425,"Senior Product Manager, Seller",Zillow,United States (Remote),5+ years,$141.2K/yr - $237.4K/yr,"Rating: Medium

This candidate brings exceptional AI/ML product management expertise and a strong track record of quantifiable impact in previous roles, particularly in fine-tuning LLMs and driving revenue. Their data-driven approach aligns well with Zillow's requirements. However, a significant gap is the lack of direct consumer-facing product experience, which is explicitly sought. All prior roles are in enterprise or financial domains, and there's no real estate industry knowledge, posing a potential learning curve for a Senior PM role focused on homeowner growth.",https://www.linkedin.com/jobs/view/4333011425/
2026-02-14 16:39 UTC,4353677169,"Product Line Manager, New College Grad- Master's (Santa Clara, CA)",Applied Materials,"Santa Clara, CA",Not specified,$96K/yr - $132K/yr,"Rating: Medium

Yi brings strong technical product management experience with a proven track record in AI/ML solutions and significant business impact, aligning with program management, NPI, and data analytics requirements. Her MS in CS fits the ""New College Grad- Master's"" profile. However, a major gap is the lack of domain expertise in semiconductors, manufacturing equipment, or hardware services. Her specific AI application experience (LLMs in finance/healthcare) also differs from the automation focus of this role.",https://www.linkedin.com/jobs/view/4353677169/
2026-02-14 16:39 UTC,4327147873,Product Manager,CodePath,United States (Remote),4+ years,$135K/yr - $175K/yr,"Rating: High

This is a strong match due to the candidate's exceptional AI product management expertise, which directly aligns with CodePath's mission to create ""AI-native engineers."" Yi demonstrates a proven track record of delivering measurable impact (e.g., revenue increase, churn reduction) through AI-powered platforms. While lacking direct EdTech experience, their strong PM fundamentals, deep technical skills in LLM fine-tuning, and data-informed approach are highly valuable. The primary gap is the need to clarify future-dated education/projects to ensure full-time availability and passion for social impact.",https://www.linkedin.com/jobs/view/4327147873/
2026-02-14 16:39 UTC,4341873151,Staff Product Manager - Marketplace,Snorkel AI,"San Francisco, CA",7+ years,$240K/yr - $300K/yr,"Rating: Medium

Yi brings exceptional AI/ML product management expertise, LLM fine-tuning skills, and a strong analytical, metrics-driven approach highly relevant to Snorkel's AI mission. Her enterprise experience is also a good fit. However, she falls short of the minimum 7+ years of PM experience (having 5 years) and lacks explicit, deep experience building ""gig economy"" or multi-sided marketplaces, which is central to this Staff PM role. Leadership experience for a Staff-level position is also not clearly demonstrated.",https://www.linkedin.com/jobs/view/4341873151/
2026-02-14 16:39 UTC,4195258177,Product Manager,Glean,"Palo Alto, CA (Hybrid)",6+ years,$105K/yr - $240K/yr,"Rating: High

This candidate is an exceptional match. While slightly under the 6+ years experience requirement (approx 5 years), their profound AI/ML product expertise, particularly in LLM fine-tuning and enterprise AI platforms, directly aligns with Glean's mission. They demonstrate a strong track record of driving quantifiable business impact across B2B settings. Key strengths include deep technical skills (PyTorch, LangChain, LLMs), a results-oriented approach, and experience scaling AI products. The main concern is the ambiguity from future-dated education/projects and being just shy of the stated experience threshold.",https://www.linkedin.com/jobs/view/4195258177/
2026-02-14 17:32 UTC,4299772432,"Product Design Lead – AI Assistant & Conversational UX(Bangkok - Based, Relocation Provided)",Agoda,"San Francisco, CA (Hybrid)",7+ years,Not listed,"Rating: Medium

This candidate is a highly accomplished AI Product Manager with extensive experience in building and scaling LLM-powered and conversational AI products, directly relevant to the role's AI focus (e.g., ChatGeneT). Her technical depth and impact metrics are exceptional. However, the core gap is the functional mismatch: this is a Product *Design* Lead role emphasizing hands-on UX/UI design, prototyping, and leading designers, whereas her background is exclusively in Product Management. Her resume lacks a design portfolio or explicit experience leading design initiatives.",https://www.linkedin.com/jobs/view/4299772432/
2026-02-14 17:32 UTC,4363385937,Senior Product Manager,Rinsed,United States (Remote),5+ years,$190K/yr - $208K/yr,"Rating: High

This candidate is an excellent match due to strong Senior PM experience (~5 years), consistent delivery of impressive business results (revenue growth, churn reduction), and relevant B2B platform experience. They demonstrate strategic thinking, data-driven execution, and full product lifecycle management. While industry-specific car wash knowledge is missing and AI isn't explicitly required, their AI expertise could be a future asset. Overall, a highly capable product leader who can adapt.",https://www.linkedin.com/jobs/view/4363385937/
2026-02-14 17:32 UTC,4312334978,"Product Manager, Cards Vault",Stripe,United States (Remote),5+ years,$146.4K/yr - $268K/yr,Error generating comment,https://www.linkedin.com/jobs/view/4312334978/
2026-02-14 17:32 UTC,4327215038,REMOTE: Senior Product Manager,IntePros,United States (Remote),7+ years,Not listed,Error generating comment,https://www.linkedin.com/jobs/view/4327215038/
2026-02-14 17:32 UTC,4290216124,"Product Manager, Consumer",Nextdoor,"San Francisco, CA",3+ years,$153K/yr - $183K/yr,Error generating comment,https://www.linkedin.com/jobs/view/4290216124/
2026-02-14 17:32 UTC,4333068532,Accelerated Computing GPU Product Manager,NVIDIA,"Santa Clara, CA",7+ years,$168K/yr - $327.8K/yr,Error generating comment,https://www.linkedin.com/jobs/view/4333068532/
2026-02-14 17:32 UTC,4355289696,Product Line Manager,Applied Materials,"Santa Clara, CA",Not specified,$124K/yr - $171K/yr,Error generating comment,https://www.linkedin.com/jobs/view/4355289696/
2026-02-14 17:32 UTC,4299772432,Unknown,Unknown,Unknown,Not specified,Not listed,Error generating comment,https://www.linkedin.com/jobs/view/4299772432/
2026-02-14 17:32 UTC,4299772432,Unknown,Unknown,Unknown,Not specified,Not listed,Error generating comment,https://www.linkedin.com/jobs/view/4299772432/
2026-02-14 18:44 UTC,4343357699,Senior Product Manager (Billing),NMI,United States (Remote),Not specified,$110K/yr - $140K/yr,"Rating: Medium

This candidate possesses strong product management fundamentals, a metrics-driven approach, and robust financial industry/platform experience. Their analytical skills and track record of impact are highly valuable. However, a significant gap is the lack of explicit experience owning a ""Billing & Invoicing"" product, building a new billing engine, or managing complex billing migrations and reconciliation, which are central to this role. While their exceptional AI expertise is a general strength, it doesn't directly align with the specific requirements of this billing-focused position.",https://www.linkedin.com/jobs/view/4343357699/
2026-02-14 18:44 UTC,4321343298,Senior Product Manager,Press Ganey,United States (Remote),5+ years,$140K/yr - $155K/yr,"Rating: High

Yi is an exceptional match. Her recent, impactful healthcare AI experience (Commure – CPT/ICD coding, claims data, 150+ orgs) aligns perfectly with Press Ganey's healthcare roots and focus on the health insurance/payvider market. Her deep AI/LLM product management expertise, combined with a strong track record of driving significant business outcomes across enterprise platforms, makes her highly qualified. Potential minor concerns include the short duration of her healthcare role and current academic status, but her overall profile is extremely strong for this Senior PM role.",https://www.linkedin.com/jobs/view/4321343298/
2026-02-14 18:44 UTC,4365583556,"Product Lead, Fulfillment & Order Experiences",Square,San Francisco Bay Area (Remote),10+ years,"$239,600",Error generating comment,https://www.linkedin.com/jobs/view/4365583556/
2026-02-14 18:44 UTC,4365640107,Technical Program Manager - Tegra and Product Diag,NVIDIA,"Santa Clara, CA",Not specified,$136K/yr - $212.8K/yr,Error generating comment,https://www.linkedin.com/jobs/view/4365640107/
2026-02-14 18:44 UTC,4332958861,Senior Accelerated Computing GPU Product Manager,NVIDIA,"Santa Clara, CA",6+ years,$168K/yr - $327.8K/yr,Error generating comment,https://www.linkedin.com/jobs/view/4332958861/
2026-02-14 18:44 UTC,4210170005,"Product Manager, Digital Marketing Enablement",IXL Learning,"San Mateo, CA",5+ years,$125K/yr - $180K/yr,Error generating comment,https://www.linkedin.com/jobs/view/4210170005/
2026-02-14 18:44 UTC,4364565394,Principal Product Manager - Performance Solutions Delivery Architecture,FactSet,United States (Remote),12+ years,"$140,000 - $170,000",Error generating comment,https://www.linkedin.com/jobs/view/4364565394/
2026-02-14 19:30 UTC,4371107327,Principal Growth Product Manager,Jobs via Dice,"San Jose, CA (On-site)",8-12 years,Not listed,Error generating comment,https://www.linkedin.com/jobs/view/4371107327/
2026-02-14 20:35 UTC,4372085754,Product Manager - AI & Data Analytics,RemoteHunter,United States (Remote),Not specified,Not listed,"Rating: High

This candidate is an outstanding match. Their extensive Product Manager experience in AI-powered enterprise platforms (Commure, JPMorgan), with direct LLM fine-tuning, ML-driven solutions, and data strategy, perfectly aligns with the role's focus. They possess strong technical AI/ML skills, a relevant academic background, and a track record of delivering significant business impact. The only potential gaps are clarifying their work authorization status (given the ""no sponsorship"" requirement) and their immediate availability while pursuing an MS.",https://www.linkedin.com/jobs/view/4372085754/
2026-02-14 20:35 UTC,4372083750,Integrations Product Manager,RemoteHunter,United States (Remote),Not specified,Not listed,Error generating comment,https://www.linkedin.com/jobs/view/4372083750/
2026-02-14 20:35 UTC,4372092699,GTM Enablement Manager,RemoteHunter,United States (Remote),5+ years,Not listed,Error generating comment,https://www.linkedin.com/jobs/view/4372092699/
2026-02-14 20:35 UTC,4372085745,Senior Product Manager (Career Sites),RemoteHunter,United States (Remote),5+ years,Not listed,Error generating comment,https://www.linkedin.com/jobs/view/4372085745/
2026-02-14 20:35 UTC,4372073788,Product Analyst,RemoteHunter,United States (Remote),Not specified,"$102,939 to $172,250",Error generating comment,https://www.linkedin.com/jobs/view/4372073788/
2026-02-14 20:35 UTC,4372093659,AI Product Manager - Remote,RemoteHunter,United States (Remote),Not specified,Not listed,Error generating comment,https://www.linkedin.com/jobs/view/4372093659/
2026-02-14 20:35 UTC,4373227608,Senior Product Manager,CaptivateIQ,"Menlo Park, CA (Remote)",8+ years,$148.3K/yr - $178.5K/yr,Error generating comment,https://www.linkedin.com/jobs/view/4373227608/
2026-02-14 20:35 UTC,4372089649,"Product Manager, Platforms",RemoteHunter,United States (Remote),5+ years,Not listed,Error generating comment,https://www.linkedin.com/jobs/view/4372089649/
2026-02-14 20:35 UTC,4373231391,Product Manager,Haystack,United States (Remote),3+ years,"$161,000 - $271,000",Error generating comment,https://www.linkedin.com/jobs/view/4373231391/
