timestamp,job_id,job_title,company,location,experience_years,salary,comment,job_url
2026-02-13 16:58 UTC,4372728948,Sr Product Manager,PatientPoint®,United States (Remote),5+ years,$133.9K/yr - $198.4K/yr,"Rating: High

This is an excellent match. The candidate possesses deep AI/ML product expertise directly within healthcare (Commure, ChatGeneT), perfectly aligning with PatientPoint's digital health innovation. Their strong PM background, focus on measurable outcomes, and robust technical skills meet all Sr. PM requirements. The only minor gap is a lack of explicit DOOH experience and a shorter tenure at Commure, but their overall profile is highly relevant and impactful.",https://www.linkedin.com/jobs/view/4372728948/
2026-02-13 16:58 UTC,4302127166,Product Manager - Vault Registrations,Veeva Systems,United States (Remote),3+ years,$75K/yr - $165K/yr,"Rating: Medium

This candidate has strong product management experience exceeding requirements, with a deep background in enterprise SaaS and demonstrable impact. Their Commure role involved healthcare AI relevant to regulatory data (CPT/ICD codes), closely aligning with the ""nice to have"" BioPharma regulatory experience. Technical skills in AI/ML and analytics are exceptional. The primary gap is the mandatory Eastern Time Zone location requirement, as the candidate is San Francisco-based. Additionally, future-dated projects/education on the resume could require clarification.",https://www.linkedin.com/jobs/view/4302127166/
2026-02-13 16:58 UTC,4341620060,"Lead Product Manager, Shopping Experience",SeatGeek,United States (Remote),8+ years,$152K/yr - $220K/yr,"Rating: Medium

This candidate offers exceptional AI/ML product expertise, with a proven track record of driving significant business impact through LLMs and data pipelines, directly aligning with SeatGeek's emphasis on AI for future shopping experiences. Their strong analytical and product skills are also valuable. However, a notable gap is the lack of direct consumer product management experience in e-commerce/shopping, as their background is primarily B2B/Enterprise. Additionally, explicit ""Lead Product Manager"" experience with mentorship responsibilities is not detailed.",https://www.linkedin.com/jobs/view/4341620060/
2026-02-13 16:58 UTC,4010660348,Product Manager,Peregrine,"San Francisco, CA",5+ years,$130K/yr - $250K/yr,"Rating: High

This candidate is an excellent match for Peregrine's AI-enabled platform. Yi brings deep AI/ML expertise (LLM fine-tuning, ML pipelines) from enterprise and financial services, with impressive quantifiable results across revenue growth and efficiency. Their strong data-centric product background (SQL/Python) and technical acumen (MS CS, AI concentration) align perfectly with the role's demands for technical and data understanding. Although slightly under the 5-year PM experience, the high quality and relevance of their work, plus SF location, strongly compensate. Current MS CS enrollment might require clarification for immediate full-time availability.",https://www.linkedin.com/jobs/view/4010660348/
2026-02-13 16:58 UTC,4301526358,Product Manager - Creative Capabilities,Luma AI,"Palo Alto, CA (Hybrid)",5+ years,Not listed,"Rating: Medium

This candidate is a strong AI Product Manager with excellent technical depth, proven ability to ship AI products with impact, and experience operationalizing research. However, the crucial gap is the lack of specific experience in generative *visual* AI, video/image editing, or multimodal vision models. Luma AI explicitly focuses on ""going beyond language models"" with ""vision,"" while the candidate's AI experience is primarily language/text/audio-based.",https://www.linkedin.com/jobs/view/4301526358/
2026-02-13 16:58 UTC,4311742651,"Staff Product Manager, Ads Ranking",Snap Inc.,"San Francisco, CA",8+ years,$195K/yr - $343K/yr,"Rating: High

Yi is an exceptional technical PM match, bringing deep AI/ML expertise in LLMs, recommendation engines, and data strategy, demonstrated by significant revenue and efficiency impacts. Their analytical prowess and track record of building cutting-edge AI products directly align with leading ads ranking and developing ML models. The primary gap is direct AdTech/social media domain experience and explicit Staff-level organizational leadership (mentoring, recruiting). However, the transferable AI PM skills and quantitative impact are highly compelling for this ML-heavy role.",https://www.linkedin.com/jobs/view/4311742651/
2026-02-13 16:58 UTC,4363443063,"Senior Product Manager, YouTube Comments",Google,"San Bruno, CA (On-site)",8+ years,$183K/yr - $271K/yr,"Rating: Low

Despite exceptional AI/LLM experience directly relevant to the role's AI focus (fine-tuning, agent deployment, ML-driven features), the candidate falls short on core requirements. She has ~5 years of enterprise PM experience, significantly less than the 8 years of *consumer* PM required. She also lacks experience with community-focused products, creator tools, or the YouTube ecosystem, which are critical for this specific role. The strong AI background is a highlight but doesn't fully bridge these fundamental domain and experience level gaps.",https://www.linkedin.com/jobs/view/4363443063/
2026-02-13 17:45 UTC,4372754356,Fulltime - IAM SSO Product Manager,E-Solutions,United States (Remote),Not specified,Not listed,"Rating: Low

Yi is a strong product manager with impressive AI/ML technical skills and a proven track record of quantifiable business impact in enterprise settings. However, this role requires deep ""IAM domain expertise"" and direct management of a 13-15 person technical team, which are significant gaps. Her extensive AI experience, while advanced, doesn't align with the core IAM integration responsibilities. She lacks specific experience in SSO, IGA platforms, or the detailed IAM integration phases.",https://www.linkedin.com/jobs/view/4372754356/
2026-02-13 17:45 UTC,4341820903,"Product Manager, Ads Platform - DSP Integrations",Netflix,"Los Gatos, CA (On-site)",3+ years,$310K/yr - $545K/yr,"Rating: Low

Yi possesses strong PM experience (5+ years), a technical AI/ML background, and a proven track record of driving impact across enterprise and financial platforms. However, this role specifically requires 3+ years of product management experience within the *programmatic advertising ecosystem*, including IAB standards (OpenRTB, VAST) and DSP integrations. Yi's resume lacks any direct experience or mention of ad tech, which is a critical gap for this specialized position. Her impressive AI skills, while valuable, are not the primary focus of this integration-heavy role.",https://www.linkedin.com/jobs/view/4341820903/
2026-02-13 17:45 UTC,4232660538,"Product Lead, Payments Risk",Rippling,"San Francisco, CA (On-site)",5+ years,$144K/yr - $252K/yr,Error generating comment,https://www.linkedin.com/jobs/view/4232660538/
2026-02-13 17:45 UTC,4372003199,"Manager, Global Products Strategic Initiatives",Visa,"San Francisco, CA (Hybrid)",3+ years,$134.6K/yr - $215.3K/yr,Error generating comment,https://www.linkedin.com/jobs/view/4372003199/
2026-02-13 17:45 UTC,4370453566,Technical Application Product Manager,VeeAR Projects Inc.,"Oakland, CA (Hybrid)",Not specified,Not listed,Error generating comment,https://www.linkedin.com/jobs/view/4370453566/
2026-02-13 17:45 UTC,4372749353,Data Collection Product Manager,Changent,United States (Remote),3+ years,$73K/yr - $87.6K/yr,Error generating comment,https://www.linkedin.com/jobs/view/4372749353/
2026-02-13 17:45 UTC,4372754356,Unknown,Unknown,Unknown,Not specified,Not listed,Error generating comment,https://www.linkedin.com/jobs/view/4372754356/
2026-02-13 17:45 UTC,4372754356,Unknown,Unknown,Unknown,Not specified,Not listed,Error generating comment,https://www.linkedin.com/jobs/view/4372754356/
2026-02-13 19:00 UTC,4372761478,Principal Product Manager,Everway,United States (Remote),3+ years,Not listed,"Rating: High

This candidate is an exceptional match. Their deep, hands-on LLM fine-tuning and AI pipeline development experience, with quantifiable impact across healthcare and finance, aligns perfectly with the role's generative AI focus. Strengths include proven ability to drive significant business growth with AI, strong technical acumen (MS CS AI), and relevant domain exposure. While PM experience duration (~5.5 years) is on the lower end for a Principal, their accelerated trajectory and specialized AI expertise mitigate this. Explicit senior leadership/mentorship examples are less prominent.",https://www.linkedin.com/jobs/view/4372761478/
2026-02-13 19:00 UTC,4339454577,Principal Product Manager - Technical,IDC,United States (Remote),7+ years,$190K/yr - $220K/yr,Error generating comment,https://www.linkedin.com/jobs/view/4339454577/
2026-02-13 19:00 UTC,4372747821,Senior Product Documentation & Knowledge Systems Manager,Total Expert,United States (Remote),5+ years,$110K/yr - $125K/yr,Error generating comment,https://www.linkedin.com/jobs/view/4372747821/
2026-02-13 19:00 UTC,4309523951,Product Line Manager,MacDermid Enthone Industrial Solutions,United States (Remote),5-8 years,Not listed,Error generating comment,https://www.linkedin.com/jobs/view/4309523951/
2026-02-13 19:00 UTC,4301510856,Product Manager - Dream Machine,Luma AI,"Palo Alto, CA (Hybrid)",5+ years,Not listed,Error generating comment,https://www.linkedin.com/jobs/view/4301510856/
2026-02-13 19:00 UTC,4372013285,Associate Product Manager,CAI,United States (Remote),3-5 years,$85K/yr - $105K/yr,Error generating comment,https://www.linkedin.com/jobs/view/4372013285/
2026-02-13 19:00 UTC,4372001558,Senior Product Manager (Staffing Industry + Bullhorn Experience),Employbridge,United States (Remote),5-7 years,$110K/yr - $138K/yr,Error generating comment,https://www.linkedin.com/jobs/view/4372001558/
2026-02-13 19:49 UTC,4364994994,Technical Product Marketing Manager,Stellar Development Foundation,"San Francisco, CA (Hybrid)",7+ years,$135K/yr - $185K/yr,Error generating comment,https://www.linkedin.com/jobs/view/4364994994/
2026-02-13 19:49 UTC,4372014890,outbond product manager,Talent Zone Consultant,"Palo Alto, CA (Hybrid)",5-10 years,$130K/yr - $160K/yr,Error generating comment,https://www.linkedin.com/jobs/view/4372014890/
2026-02-13 19:49 UTC,4372782148,Technical Product Manager,Elastic,United States (Remote),Not specified,$2000,Error generating comment,https://www.linkedin.com/jobs/view/4372782148/
2026-02-13 19:49 UTC,4347013011,Staff Product Manager - Marketplace,Snorkel AI,"Redwood City, CA",7+ years,$240K/yr - $300K/yr,Error generating comment,https://www.linkedin.com/jobs/view/4347013011/
2026-02-13 19:49 UTC,4372016893,"Senior Product Manager, Team Tooling",BetterUp,"San Francisco, CA (Hybrid)",5+ years,"$168,000 - $231,000",Error generating comment,https://www.linkedin.com/jobs/view/4372016893/
2026-02-13 19:49 UTC,4372774429,"Product Manager, Intelligence",Sierra Business Solution,"San Francisco, CA (On-site)",Not specified,Not listed,Error generating comment,https://www.linkedin.com/jobs/view/4372774429/
2026-02-13 19:49 UTC,4364511355,Product Manager (Signal Generation Solutions),Keysight Technologies,"Santa Rosa, CA (On-site)",Not specified,$149.8K/yr - $274.8K/yr,Error generating comment,https://www.linkedin.com/jobs/view/4364511355/
2026-02-13 20:47 UTC,4372788594,Sr. Product Manager,Supermicro,"San Jose, CA (On-site)",8+ years,$162K/yr - $182K/yr,Error generating comment,https://www.linkedin.com/jobs/view/4372788594/
2026-02-13 20:47 UTC,4372029304,"Manager, Product Portfolio Operations, Issuing Solutions",Visa,"San Francisco, CA (Hybrid)",3+ years,$116.3K/yr - $187.4K/yr,Error generating comment,https://www.linkedin.com/jobs/view/4372029304/
2026-02-13 20:47 UTC,4372041123,Product Manager-New Consumer Products,Allstate,United States (Remote),5+ years,$100K/yr - $170K/yr,Error generating comment,https://www.linkedin.com/jobs/view/4372041123/
2026-02-13 20:47 UTC,4372030312,Enterprise Product Manager,Hatch,United States (Remote),5+ years,$104K/yr - $269K/yr,Error generating comment,https://www.linkedin.com/jobs/view/4372030312/
2026-02-13 20:47 UTC,4372747224,"Associate, Product Manager II",BlackRock,"San Francisco, CA (Hybrid)",3+ years,"$132,500.00",Error generating comment,https://www.linkedin.com/jobs/view/4372747224/
2026-02-13 20:47 UTC,4344549639,Lead Product Manager,Greenbox Capital,United States (Remote),5+ years,Not listed,Error generating comment,https://www.linkedin.com/jobs/view/4344549639/
2026-02-13 20:47 UTC,4372790223,Product Outcomes Manager,Gong,"San Francisco, CA",Not specified,$98K/yr - $145K/yr,Error generating comment,https://www.linkedin.com/jobs/view/4372790223/
2026-02-13 21:43 UTC,4372038335,Product Developer,FetchJobs.co,United States (Remote),Not specified,$84.9K/yr - $138.6K/yr,"Rating: Medium

Yi meets the 5+ years for the Product Developer role, demonstrating strong product management with significant, quantifiable impact in AI/tech. Key strengths include proven execution, analytical prowess, and results-driven PM experience. However, a major weakness is the complete lack of experience in the utility/energy sector, which is essential (""understanding of utility operations""). Her specialized AI background, while impressive, isn't directly relevant to the described energy efficiency/renewable programs, creating a significant domain mismatch.",https://www.linkedin.com/jobs/view/4372038335/
2026-02-13 21:43 UTC,4364550025,Associate Upstream Product Manager,Ladders,United States (Remote),5+ years,$152.2K/yr - $196.9K/yr,Error generating comment,https://www.linkedin.com/jobs/view/4364550025/
2026-02-13 21:43 UTC,4372785957,Sr Lead Product Manager - Network,Lumen Technologies,United States (Remote),7+ years,$129.6K/yr - $172.9K/yr,Error generating comment,https://www.linkedin.com/jobs/view/4372785957/
2026-02-13 21:43 UTC,4372799432,MarTech Product Manager – AEP,Inizio Partners,United States (Remote),7+ years,$160K/yr,Error generating comment,https://www.linkedin.com/jobs/view/4372799432/
2026-02-13 21:43 UTC,4372905214,Sr. Product Operations Manager,One Inc,United States (Remote),7+ years,Not listed,Error generating comment,https://www.linkedin.com/jobs/view/4372905214/
2026-02-13 22:40 UTC,4357750742,Product Manager,Net2Source (N2S),"Foster City, CA (On-site)",5+ years,$55,"Rating: Medium

This candidate brings excellent domain knowledge from Commure (healthcare AI) and strong, impact-driven product management experience in digital platforms. Key strengths include direct healthcare system/pharma industry exposure, robust technical/product toolkit, and demonstrated ability to manage complex initiatives. However, she falls short of the ""5+ years"" experience requirement by roughly a year. A significant concern is her ongoing MS degree which directly overlaps with the 11-month onsite contract duration. Specific tool familiarity (MS Project, Smartsheets) is also not explicitly listed.",https://www.linkedin.com/jobs/view/4357750742/
2026-02-13 22:40 UTC,4372798763,"Product Manager , Consumer Marketplace",Everfit,San Francisco Bay Area (Hybrid),5+ years,Not listed,"Rating: Medium

This candidate offers outstanding AI/ML product management skills, a critical asset for Everfit's AI-powered marketplace. She consistently delivers measurable impact and demonstrates a strong ""zero to one"" building mentality. However, her background is almost entirely in enterprise/B2B finance and healthcare. She lacks explicit experience in consumer marketplaces, social apps, or direct knowledge of fitness/wellness trends, which are central to the role's success.",https://www.linkedin.com/jobs/view/4372798763/
2026-02-13 22:40 UTC,4363435558,"Staff Product Manager, Aurora Services",Aurora,"San Francisco, CA (Hybrid)",5+ years,$181K/yr - $262K/yr,Error generating comment,https://www.linkedin.com/jobs/view/4363435558/
2026-02-13 22:40 UTC,4372030492,Product Manager Intern,Typeface,"Palo Alto, CA (Hybrid)",Not specified,$40,"Rating: High

**Analysis:** Emma is exceptionally qualified, bringing 5+ years of high-impact AI/Enterprise PM experience. Her deep expertise in LLMs, fine-tuning, AI pipelines, and data-driven growth (acquisition, retention, revenue, A/B testing) aligns perfectly with Typeface's GenAI and growth focus. She meets all educational and skill requirements, including analytics bonuses. The primary concern is overqualification for an intern role; her extensive background and potential salary expectations might exceed typical intern profiles, posing a possible mismatch in role expectations or retention.",https://www.linkedin.com/jobs/view/4372030492/
2026-02-13 22:40 UTC,4364474386,Sr. Technical Product Manager,McGraw Hill,United States (Remote),5+ years,$124.4K/yr - $142.8K/yr,Error generating comment,https://www.linkedin.com/jobs/view/4364474386/
2026-02-13 22:40 UTC,4372777627,"Product Manager - Pricing, Cloud Economics, and Product Strategy (SF/ Sunnyvale/New York)",Crusoe,"San Francisco, CA (On-site)",Not specified,$172K/yr - $209K/yr,Error generating comment,https://www.linkedin.com/jobs/view/4372777627/
2026-02-13 22:40 UTC,4372792778,Manager / Sr. Manager Solutions Consulting - Central Region,Sprinklr,NAMER (Remote),6-10 years,"$146,000 - $244,000",Error generating comment,https://www.linkedin.com/jobs/view/4372792778/
2026-02-13 23:37 UTC,4372797629,"Product Manager, Automation - Go to Market (GTM)",Cash App,San Francisco Bay Area (Remote),Not specified,"$198,000","Rating: High

This candidate is an excellent match due to their deep AI Product Management experience, specifically with LLM fine-tuning, human-in-the-loop systems, and quantifiable business impact across enterprise platforms. Their technical skills (PyTorch, LangChain, LLM evaluation) and ability to build end-to-end intelligent systems are highly relevant to the role's automation focus. While direct, explicit experience across the *full* Go-to-Market lifecycle is less prominent, their achievements in areas like customer health scoring and revenue growth demonstrate transferable skills. The financial industry background is a bonus.",https://www.linkedin.com/jobs/view/4372797629/
2026-02-13 23:37 UTC,4372032633,Sr. Product Manager - Martech,Hirewell,United States (Remote),7+ years,$140K/yr - $160K/yr,Error generating comment,https://www.linkedin.com/jobs/view/4372032633/
2026-02-13 23:37 UTC,4372038580,Product Manager (Mini PC),ASUS,"Fremont, CA (Hybrid)",3+ years,$80K/yr - $120K/yr,Error generating comment,https://www.linkedin.com/jobs/view/4372038580/
2026-02-13 23:37 UTC,4371715046,Sr Product Manager,Elixir Medical Corporation,"Milpitas, CA (On-site)",7+ years,$140K/yr - $170K/yr,Error generating comment,https://www.linkedin.com/jobs/view/4371715046/
2026-02-14 02:14 UTC,4372946547,Product Lead (Crypto / DeFi),Jobgether,United States (Remote),5+ years,Not listed,"Rating: Medium

This candidate offers exceptional technical product management experience (5+ years), a strong financial background, and a proven track record of delivering impactful, data-driven products with significant results. Key strengths include complex data analysis, reducing discrepancies, and end-to-end product execution. However, the primary weakness is a complete lack of demonstrated experience or knowledge in crypto trading and DeFi protocols, which is a critical requirement for this specialized ""Product Lead (Crypto / DeFi)"" role. While highly capable, the domain expertise gap is substantial.",https://www.linkedin.com/jobs/view/4372946547/
2026-02-14 02:14 UTC,4364541890,"Senior Product Manager, Provider Pay and Incentives",Spring Health,"San Francisco, CA (Hybrid)",3+ years,$165K/yr - $202.5K/yr,Error generating comment,https://www.linkedin.com/jobs/view/4364541890/
2026-02-14 02:14 UTC,4364541882,"Product Adoption Manager, Lower Funnel","Reddit, Inc.",United States (Remote),10+ years,$182K/yr - $254.8K/yr,Error generating comment,https://www.linkedin.com/jobs/view/4364541882/
2026-02-14 02:14 UTC,4364159488,"Product Adoption Manager, Shopping","Reddit, Inc.",United States (Remote),10+ years,$182K/yr - $254.8K/yr,Error generating comment,https://www.linkedin.com/jobs/view/4364159488/
2026-02-14 02:14 UTC,4364408383,Agent Assist Product Manager,Cresta,United States (Remote),3-5 years,$130K/yr - $190K/yr,Error generating comment,https://www.linkedin.com/jobs/view/4364408383/
2026-02-14 02:14 UTC,4364466201,"Platform Lead – Intelligence & Personalization, AirCover",Airbnb,United States (Remote),15+ years,$224K/yr - $280K/yr,Error generating comment,https://www.linkedin.com/jobs/view/4364466201/
2026-02-14 02:14 UTC,4364551487,Associate Product Manager Intern,Lensa,"San Francisco, CA (On-site)",Not specified,$55,Error generating comment,https://www.linkedin.com/jobs/view/4364551487/
2026-02-14 02:14 UTC,4372946547,Unknown,Unknown,Unknown,Not specified,Not listed,Error generating comment,https://www.linkedin.com/jobs/view/4372946547/
2026-02-14 02:14 UTC,4372946547,Unknown,Unknown,Unknown,Not specified,Not listed,Error generating comment,https://www.linkedin.com/jobs/view/4372946547/
2026-02-14 04:44 UTC,4364438010,Growth Lead/Staff Product Manager (B2C),Point,"Palo Alto, CA (Remote)",5+ years,$175,"Rating: Medium

This candidate offers strong product management experience with impressive, quantifiable impact on revenue, churn, and efficiency, leveraging AI/ML and data strategy. Their strategic thinking, product execution, and analytical skills are highly relevant for a growth role. However, a significant gap is the lack of explicit B2C product management experience, as all roles are enterprise-focused. While they have finance experience, it's institutional, not consumer home equity. This B2C and direct growth experience mismatch is a notable concern.",https://www.linkedin.com/jobs/view/4364438010/
2026-02-14 04:44 UTC,4364456960,Sr Principal Product Manager/Strategy,Oracle,United States (Remote),Not specified,$115.4K/yr - $251.6K/yr,Error generating comment,https://www.linkedin.com/jobs/view/4364456960/
2026-02-14 04:44 UTC,4372971529,Product Operations Lead,Plaid,"San Francisco, CA (Hybrid)",8+ years,$150K/yr - $230K/yr,"Rating: Medium

Analysis:
This candidate offers exceptional AI/ML product experience, a strong technical background, and a proven track record of driving impact, directly addressing the role's AI/automation focus. However, a notable gap exists in the required 8+ years of experience in dedicated Product Operations or Program Management roles; the candidate has ~5 years of Product Manager experience. While transferable, the lack of direct experience defining product ops systems and cadences for a large organization is a weakness for this lead role.",https://www.linkedin.com/jobs/view/4372971529/
2026-02-14 04:44 UTC,4364466948,Regional Product Expert,Xsolla,United States (Remote),5+ years,$120K/yr - $154K/yr,Error generating comment,https://www.linkedin.com/jobs/view/4364466948/
2026-02-14 04:44 UTC,4372983013,Senior Staff Product Manager - Unified Checkout,Intuit,"Mountain View, CA (On-site)",8+ years,$196.5K/yr - $266K/yr,Error generating comment,https://www.linkedin.com/jobs/view/4372983013/
2026-02-14 04:44 UTC,4372969513,Senior Product Manager - Pricing & Packaging,Crunchbase,"San Francisco, CA (Remote)",5+ years,$162.4K/yr - $191.1K/yr,Error generating comment,https://www.linkedin.com/jobs/view/4372969513/
2026-02-14 05:48 UTC,4372971845,Product Manager - Core Product,Baseten,"San Francisco, CA (Hybrid)",4+ years,$200K/yr - $275K/yr,"Rating: High

Emma is a strong match, exceeding the PM experience requirement with 4+ years in AI-focused roles. Her deep technical background (MS CS AI, PyTorch, LLM fine-tuning, pipeline building) and direct experience deploying impactful AI products (e.g., CPT/ICD coding, patient simulator) demonstrate profound empathy for ML developers and a nuanced understanding of their needs, aligning with Baseten's mission. While specific experience *building* core ML infrastructure developer tools isn't explicitly stated, her background building and optimizing AI applications makes her an ideal candidate to shape a seamless AI deployment platform.",https://www.linkedin.com/jobs/view/4372971845/
2026-02-14 05:48 UTC,4372970858,Product Manager - Infrastructure,Baseten,"San Francisco, CA (Hybrid)",4+ years,$200K/yr - $275K/yr,Error generating comment,https://www.linkedin.com/jobs/view/4372970858/
2026-02-14 05:48 UTC,4372065071,AI Outcomes Manager- West,Glean,United States (Remote),5+ years,$130K/yr - $210K/yr,Error generating comment,https://www.linkedin.com/jobs/view/4372065071/
2026-02-14 05:48 UTC,4372064058,AI Outcomes Manager- West,Glean,San Francisco Bay Area (Hybrid),5+ years,$150K/yr - $212K/yr,Error generating comment,https://www.linkedin.com/jobs/view/4372064058/
2026-02-14 05:48 UTC,4372053101,AI Outcomes Manager- East,Glean,United States (Remote),5+ years,$150K/yr - $212K/yr,Error generating comment,https://www.linkedin.com/jobs/view/4372053101/
2026-02-14 05:48 UTC,4372039599,AI Outcomes Manager- Central,Glean,United States (Remote),5+ years,$150K/yr - $200K/yr,Error generating comment,https://www.linkedin.com/jobs/view/4372039599/
