timestamp,job_id,job_title,company,location,experience_years,salary,comment,job_url
2026-02-14 21:31 UTC,4372090674,TikTok Ads Manager - Senior Product Designer,TikTok,"San Jose, CA (On-site)",Not specified,$137244 - $255867,"Rating: Low

This candidate is an accomplished, AI-focused Product Manager with strong quantitative results and enterprise experience. However, the role is for a Senior Product Designer, requiring hands-on UI/UX design, prototyping, and visual design skills. The resume lacks specific design deliverables, a design portfolio, or direct experience in product design roles, making it a poor fit despite her strong product sense, technical depth, and experience with complex enterprise platforms.",https://www.linkedin.com/jobs/view/4372090674/
2026-02-14 21:31 UTC,4372090674,Unknown,Unknown,Unknown,Not specified,Not listed,Error generating comment,https://www.linkedin.com/jobs/view/4372090674/
2026-02-14 21:31 UTC,4372090674,Unknown,Unknown,Unknown,Not specified,Not listed,Error generating comment,https://www.linkedin.com/jobs/view/4372090674/
2026-02-14 22:31 UTC,4373244250,"Lead Product Manager, Expense Experience",Navan,"Palo Alto, CA (Hybrid)",7-10 years,"$139,050",Error generating comment,https://www.linkedin.com/jobs/view/4373244250/
2026-02-14 22:31 UTC,4372075811,Product Developer,FetchJobs.co,United States (Remote),Not specified,"$84,900 to $120,567",Error generating comment,https://www.linkedin.com/jobs/view/4372075811/
2026-02-14 23:31 UTC,4373238387,Product Manager,Atlantic Partners Corporation,San Francisco Bay Area (Hybrid),7+ years,$150K/yr - $200K/yr,Error generating comment,https://www.linkedin.com/jobs/view/4373238387/
2026-02-14 23:31 UTC,4372071978,Staff Product Designer,Buyers Edge Platform,United States (Remote),8+ years,Not listed,Error generating comment,https://www.linkedin.com/jobs/view/4372071978/
2026-02-14 23:31 UTC,4373238387,Unknown,Unknown,Unknown,Not specified,Not listed,Error generating comment,https://www.linkedin.com/jobs/view/4373238387/
2026-02-14 23:31 UTC,4373238387,Unknown,Unknown,Unknown,Not specified,Not listed,Error generating comment,https://www.linkedin.com/jobs/view/4373238387/
2026-02-15 02:34 UTC,4373249622,"Sr. Product Manager-Tech, Photos on Alexa+, Amazon Photos",Amazon,"Sunnyvale, CA",5-8 years,Not listed,"Rating: High

This is a strong match due to Emma's deep LLM/AI expertise, including fine-tuning and evaluation, and her MS in CS (AI). Her technical PM background and experience shipping AI products with measurable impact, including a conversational AI agent (ChatGeneT), directly address the core ""AI product builder"" requirement. While most work is enterprise, her project experience bridges the consumer AI gap. Main weaknesses are limited direct consumer-facing multimodal AI experience and domain knowledge in photos/memories on smart devices.",https://www.linkedin.com/jobs/view/4373249622/
2026-02-15 02:34 UTC,4373241602,Entry Level Product Manager: 2026,Lensa,"San Jose, CA (On-site)",Not specified,Not listed,"Rating: Low

This candidate is significantly overqualified for an ""Entry Level Product Manager"" role, possessing 5+ years of relevant AI/ML product management experience at major firms and unicorns. While her extensive AI/ML expertise (LLM fine-tuning, ML-driven platforms), strong product management fundamentals, and proven track record in enterprise AI products perfectly align with the job's core responsibilities, the stated experience level is a critical mismatch. Her strongest assets are her ability to drive significant business impact with AI products and deep technical understanding. The main gap is her substantial prior experience exceeding the ""entry level"" designation.",https://www.linkedin.com/jobs/view/4373241602/
2026-02-15 02:34 UTC,4373246591,Summer 2026 Product Manager Intern,Lensa,"Mountain View, CA (On-site)",Not specified,$45.67 - $70.37,Error generating comment,https://www.linkedin.com/jobs/view/4373246591/
2026-02-15 02:34 UTC,4373240781,"Product Manager, Healthcare SaaS - Patient Support (Remote)",Lensa,United States (Remote),5+ years,Not listed,Error generating comment,https://www.linkedin.com/jobs/view/4373240781/
2026-02-15 02:34 UTC,4373237839,"Principal Product Manager Tech - Devices, Fire TV Devices",Lensa,"Sunnyvale, CA (On-site)",8+ years,Not listed,"Rating: Low

This candidate has strong technical acumen in AI/ML and a proven track record of driving significant business impact as a PM. However, the role explicitly requires experience in consumer technology products, connected devices, and a passion for TV/mobile video – all areas the candidate lacks. Their background is predominantly in enterprise AI and financial services. Additionally, 5 years of experience, while impressive, is likely insufficient for a Principal PM role at Amazon.",https://www.linkedin.com/jobs/view/4373237839/
2026-02-15 02:34 UTC,4373250322,"Product Manager, Platform",Brain Co.,San Francisco Bay Area (Hybrid),Not specified,Not listed,"Rating: High

This is an excellent match. The candidate's deep AI/ML product experience, especially with LLMs and fine-tuning in high-stakes regulated environments (healthcare, finance), perfectly aligns with Brain Co.'s mission. She has a proven track record of building and scaling robust platforms with strong impact. Her technical background and ""builder mindset"" are significant strengths. While specific experience *defining* platform standards for *other* internal product teams isn't explicitly detailed, her overall expertise makes her exceptionally well-suited to drive this role's objectives.",https://www.linkedin.com/jobs/view/4373250322/
2026-02-15 04:57 UTC,4331053285,Senior Product Manager,AddEvent,"San Francisco, CA (Hybrid)",5+ years,Not listed,"Rating: Medium

Analysis:
Candidate exhibits strong Senior PM skills: revenue-driven mindset, analytical rigor, demonstrated impact (scaling products, increasing revenue/profit, reducing churn), and excellent technical depth (MS CS, AI expertise). This aligns well with a ""2nd product team member"" in a fast-growing SaaS company. However, their extensive AI/FinTech/HealthTech background may be overqualified or misaligned with AddEvent's MarTech SaaS domain, which doesn't mention AI. The ongoing Master's program until Dec 2025 also raises questions about immediate availability for a full-time role.",https://www.linkedin.com/jobs/view/4331053285/
2026-02-15 04:57 UTC,4360857599,Principal Product Manager,Metrics Recruitment,San Francisco Bay Area (Hybrid),Not specified,Not listed,Error generating comment,https://www.linkedin.com/jobs/view/4360857599/
2026-02-15 04:57 UTC,4366988788,Lead Product Manager,interface.ai,San Francisco Bay Area (On-site),5+ years,$200/yr - $240/yr,Error generating comment,https://www.linkedin.com/jobs/view/4366988788/
2026-02-15 04:57 UTC,4366942474,"AI Product Manager, Insights",Scale AI,San Francisco Bay Area (Hybrid),5-10 years,"$206,800",Error generating comment,https://www.linkedin.com/jobs/view/4366942474/
2026-02-15 04:57 UTC,4345929721,Product Manager - AI Agents,Assembled,San Francisco Bay Area (Hybrid),3+ years,$180K/yr - $225K/yr,Error generating comment,https://www.linkedin.com/jobs/view/4345929721/
2026-02-15 04:57 UTC,4370420778,Product Manager -ML,Insight Global,"Oakland, CA (Hybrid)",Not specified,$70,Error generating comment,https://www.linkedin.com/jobs/view/4370420778/
2026-02-15 06:00 UTC,4359274206,Sr. Product Manager,AKASA,"San Francisco County, CA (Hybrid)",5+ years,$185K/yr - $240K/yr,"Rating: High

This candidate is an exceptional match. Their Commure experience directly aligns with AKASA's mission, showcasing expertise in fine-tuning LLMs for CPT/ICD coding, reducing denials, and scaling to healthcare organizations. Strong AI/ML skills (LLM fine-tuning, evaluation) and a proven track record of quantifiable impact in enterprise settings are major strengths. The MS in AI further bolsters technical depth. A potential weakness is current full-time MS enrollment until Dec 2025, impacting immediate availability.",https://www.linkedin.com/jobs/view/4359274206/
2026-02-15 06:00 UTC,4368928556,Product Manager - Genspark for Business,Genspark,"Palo Alto, CA (On-site)",5-10 years,$150K/yr - $250K/yr,"Rating: High

This candidate is an excellent match, particularly given Genspark's focus on AI-powered enterprise platforms. Her deep experience with LLM fine-tuning, AI pipeline development, and quantifiable business impact for large organizations (healthcare, finance) is highly relevant. She meets the minimum experience requirement and demonstrates strong product ownership and results, aligning with the ""demonstrable impact"" requirement. While her background isn't strictly from a pure ""PLG SaaS"" company, her achievements reflect product-led growth principles. The primary minor gap might be her being at the lower end of the experience range for a role reporting to a Co-Founder.",https://www.linkedin.com/jobs/view/4368928556/
2026-02-15 06:00 UTC,4353556148,Principal Product Manager (Public Sector),Altana,"San Francisco, CA",8+ years,$200K/yr - $255K/yr,Error generating comment,https://www.linkedin.com/jobs/view/4353556148/
2026-02-15 14:23 UTC,4321327149,Staff Product Manager - MetaMask (Sports),Consensys,United States (Remote),10+ years,"$146,000","Rating: Medium-High

This candidate possesses strong product leadership, driving significant business impact across complex AI/enterprise platforms. Their deep financial trading background and technical acumen (MS in CS, AI/ML skills) are highly relevant to prediction markets and sports betting mechanics. While direct Web3/blockchain experience is absent, their strategic ownership, data-driven approach, and proven ability to lead new product pillars are strong qualifications for this high-leverage role. The main gap is their lack of explicit Web3 domain knowledge for Consensys's core business.",https://www.linkedin.com/jobs/view/4321327149/
2026-02-15 14:23 UTC,4373297347,Product Manager (Remote),Jobgether,"California, United States (Remote)",7+ years,Not listed,"Rating: Medium

This candidate offers exceptional AI/ML product expertise, particularly in health tech with demonstrable, quantifiable impact (e.g., 20% revenue increase, 25% reduction in denials). Their experience in highly regulated industries (finance, healthcare) and strong technical background are significant assets. However, the candidate's total PM experience (~4.9 years) falls short of the ""7+ years"" requirement for a Senior PM role, and they lack explicit experience managing a team of product managers. While strong in health AI applications, direct experience overseeing foundational clinical platform services is less evident.",https://www.linkedin.com/jobs/view/4373297347/
2026-02-15 14:23 UTC,4364724006,Senior Digital Product Manager,SquareTrade,"San Francisco, CA (Hybrid)",4+ years,$30,"Rating: High

This candidate is an exceptional match. Their senior-level product management experience, combined with a strong track record of driving measurable business outcomes and a customer-obsessed mindset, perfectly aligns with the role. The experience fine-tuning LLMs for claims automation (CPT/ICD codes) and transforming complex workflows is highly relevant to SquareTrade's troubleshooting and claim filing focus. While direct insurance domain experience isn't explicit, the candidate's proven ability to leverage advanced AI on digital platforms to achieve significant business impact makes them a standout for reimagining customer experiences.",https://www.linkedin.com/jobs/view/4364724006/
2026-02-15 14:23 UTC,4333213379,"Product Manager, Contributor (CB) Pay & Incentives",Scale AI,San Francisco Bay Area (Hybrid),5-8 years,"$164,800","Rating: High

This candidate is a strong match. Their extensive AI/ML product leadership, including LLM fine-tuning and building AI pipelines, directly aligns with Scale AI's core business and ""nice-to-have"" skills. Their proven analytical ability, strong quantitative background, and track record of driving significant business impact (revenue, profit, churn reduction, scaling products) are excellent. While lacking direct ""Pay & Incentives"" domain experience and having a recent short tenure, their deep technical product expertise and academic profile make them highly competitive.",https://www.linkedin.com/jobs/view/4333213379/
2026-02-15 14:23 UTC,4361067300,Product Manager - Industrial Cybersecurity,UL Solutions,"Fremont, CA (Hybrid)",5+ years,$130K/yr - $140K/yr,"Rating: Medium

The candidate presents a strong profile with exceptional AI product management experience, quantifiable impact, and deep technical skills in LLMs and enterprise platforms. However, the critical requirement for 5+ years in the *Industrial Cybersecurity* industry is a major gap in their resume. While their AI expertise is highly relevant, the lack of domain-specific knowledge in areas like grid-tied products or factory applications, coupled with PM experience just shy of 5 years, makes this a moderate match.",https://www.linkedin.com/jobs/view/4361067300/
2026-02-15 14:23 UTC,4347071563,Principal Product Manager - Kubernetes & Compute Abstractions,CoreWeave,"San Francisco, CA",Not specified,$206K/yr - $303K/yr,"Rating: Medium

This candidate offers exceptional, impactful AI product management experience, driving significant business outcomes with LLMs and ML pipelines at enterprise scale. Their strong technical foundation (MS CS AI, specific AI/ML skills) aligns well with CoreWeave's mission. However, a major gap is the lack of explicit experience with Kubernetes, VMs, Bare Metal, or core cloud compute infrastructure, which are central to this role. Their experience leans towards AI applications, not compute abstractions. The candidate's experience level is also potentially light for a Principal role.",https://www.linkedin.com/jobs/view/4347071563/
2026-02-15 14:23 UTC,4365709272,Technical Product Manager - AI,Sardine,NAMER (Remote),3+ years,$145,"Rating: High

This candidate is an excellent match, exceeding technical requirements with extensive hands-on LLM fine-tuning, GenAI, and AI agent development across enterprise platforms. Their 5+ years of PM experience combined with deep technical AI/ML skills directly align with the role's focus on defining and launching AI-powered products. Strongest points include quantifiable impact, relevant financial services background, and proven execution on complex AI pipelines. A minor gap is the lack of explicit fraud/AML domain experience, though financial services experience is highly transferable.",https://www.linkedin.com/jobs/view/4365709272/
2026-02-15 15:33 UTC,4347181391,Principal Product Manager - Kubernetes & Compute Abstractions,CoreWeave,"Sunnyvale, CA",Not specified,$206K/yr - $303K/yr,"Rating: Medium

This candidate is a strong AI Product Manager with an impressive track record and deep AI application experience. However, the role is highly focused on **Kubernetes and compute abstractions (VMs, Bare Metal)**, which are not explicitly mentioned in the candidate's resume. While their AI expertise is valuable for CoreWeave's mission, the critical infrastructure-level domain knowledge seems to be a significant gap for a Principal PM in this specific area. Their ~5 years of PM experience might also be light for a ""Principal"" title.",https://www.linkedin.com/jobs/view/4347181391/
2026-02-15 15:33 UTC,4347051678,"Senior Product Manager, GPU Compute",CoreWeave,"Sunnyvale, CA",5+ years,$165K/yr - $242K/yr,"Rating: Medium

Yi meets the 5+ years PM experience and possesses strong AI product expertise, including LLM fine-tuning and pipeline development, with proven business impact. Her technical AI/ML skills are excellent. However, a notable gap is explicit experience in cloud infrastructure, IaaS/PaaS, or GPU architectures. Her background focuses on *applying* AI in enterprise settings rather than *managing the underlying compute infrastructure* for an AI hyperscaler.",https://www.linkedin.com/jobs/view/4347051678/
2026-02-15 15:33 UTC,4324040699,Senior Product Manager,Kikoff,"San Francisco, CA (Hybrid)",2+ years,Not listed,"Rating: High

This candidate is an excellent fit, uniquely blending deep AI/ML expertise with a strong financial product background, aligning perfectly with Kikoff's mission as an AI-powered FinTech. Strengths include quantifiable impact, extensive LLM/ML skills, solid PM fundamentals, and experience in fast-paced environments. While direct consumer FinTech experience is less explicit, her finance domain knowledge and AI prowess are highly relevant and easily transferable. The ""Senior"" title is supported by her impact and specialized skills.",https://www.linkedin.com/jobs/view/4324040699/
2026-02-15 15:33 UTC,4354322891,"Staff Product Manager, Growth (Hybrid)",Homebase,"San Francisco, CA (Hybrid)",8+ years,Not listed,"Rating: Medium

Analysis: The candidate demonstrates exceptional AI product expertise and strong quantitative, data-driven impact in growth and revenue, aligning well with Homebase's AI-powered vision. However, they fall short on the 8+ years of PM experience (~5 years) and critically lack the required experience managing other PMs for a Staff-level role. Their current student status until Dec 2025 also raises concerns about immediate availability. Specific freemium-to-paid and onboarding ownership is less explicit.",https://www.linkedin.com/jobs/view/4354322891/
2026-02-15 15:33 UTC,4302849594,Product Manager,Granicus,United States (Remote),3-5 years,$100K/yr - $114K/yr,"Rating: High

Emma is an outstanding match for the AI/ML innovation aspect, with deep experience in LLM fine-tuning and agentic AI. Her track record of driving significant business impact with AI products across enterprise platforms is highly relevant. She also demonstrates strong PM fundamentals (Agile, Jira, data-driven decisions). The main gap is a lack of direct GovTech domain experience, and her current study status (MS starts Sep 2024, last role ended Apr 2024) might require clarification regarding immediate availability.",https://www.linkedin.com/jobs/view/4302849594/
2026-02-15 15:33 UTC,4292028453,"Lead Product Manager, Risk-Based Product Innovation",WEX,San Francisco Bay Area,10+ years,$139K/yr - $185K/yr,"Rating: High

Yi is an excellent match for this Lead PM role, bringing deep financial services and payments experience from JPMorgan and Société Générale. Her proven ability to drive significant business outcomes (revenue, profit, churn reduction) and collaborate on financial strategy aligns perfectly with the job's focus on risk-based products. While the role doesn't explicitly call for AI, her extensive AI/ML product background is a significant differentiator for future innovation in areas like risk modeling or underwriting. Her short tenure at Commure is a minor point.",https://www.linkedin.com/jobs/view/4292028453/
2026-02-15 15:33 UTC,4274231706,Legal Technology Product Manager,Simpson Thacher & Bartlett LLP,"Palo Alto, CA (Hybrid)",5+ years,$175K/yr - $210K/yr,"Rating: High

This candidate is a strong match due to exceptional AI/LLM product management expertise, precisely aligning with the job's ""AI tools"" focus. They possess a proven track record in enterprise environments, driving significant impact with ML/AI solutions and robust product lifecycle management. The primary gap is direct legal domain expertise, crucial for the ""in-house expert"" aspect. However, their experience in a regulated financial industry and rapid learning ability suggests a capacity to quickly adapt to the legal sector.",https://www.linkedin.com/jobs/view/4274231706/
2026-02-15 16:40 UTC,4310223248,Senior Product Operations Manager,Harvey,"San Francisco, CA (Hybrid)",6+ years,$178K/yr - $210K/yr,"Rating: Medium

Yi possesses outstanding AI/enterprise PM experience, technical depth in LLMs, and strong quantitative results highly relevant to Harvey. Her 5 years of PM experience align with the tenure. However, the resume lacks explicit achievements in core Product Operations responsibilities like designing company-wide operational frameworks, managing launch calendars across GTM teams, or building dedicated feedback/alpha testing *systems*. While she has PM skills, direct process ownership for scaling product operations isn't clearly demonstrated.",https://www.linkedin.com/jobs/view/4310223248/
2026-02-15 16:40 UTC,4373293622,Product Manager,Arc.dev,United States (Remote),3-5 years,Not listed,"Rating: Medium

The candidate brings strong AI/ML product expertise, excelling in LLM fine-tuning, AI pipelines, and driving significant business impact for enterprise platforms. Their technical AI skills and education are highly relevant. However, they fall short on the ""8+ years of PM experience"" (candidate has ~5) and critical requirements for distributed systems, Kubernetes, and especially decentralized technologies (blockchain/DLT) which are central to Arc.dev's platform. The lack of direct experience with cloud infrastructure/MLOps tooling beyond the AI application also presents a gap for this Director-level orchestration role.",https://www.linkedin.com/jobs/view/4373293622/
2026-02-15 16:40 UTC,4317533463,AI Product Manager - Remote,First American,"Santa Rosa, CA (Remote)",3-5 years,$148.6K/yr - $198.2K/yr,"Rating: Medium

Yi is a highly skilled AI Product Manager with impressive experience in LLMs, RAG, and predictive analytics, delivering quantifiable impact in regulated finance and healthcare. This technical depth and domain relevance are excellent for the role's AI strategy and governance needs. However, the candidate's approximately 5 years of total PM experience falls significantly short of the 10+ years requirement, and explicit people management experience is not detailed. The ongoing MS CS program also raises concerns about immediate full-time availability.",https://www.linkedin.com/jobs/view/4317533463/
2026-02-15 16:40 UTC,4372331406,Product Developer,FetchJobs.co,United States (Remote),Not specified,Not listed,"Rating: Low

Analysis:
Emma demonstrates strong AI/LLM product management expertise with impressive, quantifiable results. However, her experience level is slightly under the 5-year minimum for Product Developer and significantly below for Senior. A major gap is the lack of direct experience in the energy sector or utility customer programs, which is explicitly advantageous. While her technical product skills are strong, they may be over-specialized given the job's focus on traditional energy program development rather than AI-specific roles within the energy domain.",https://www.linkedin.com/jobs/view/4372331406/
2026-02-15 17:31 UTC,4332948708,Senior Silicon and System Product Lead,NVIDIA,"Santa Clara, CA (Hybrid)",8+ years,$168K/yr - $310.5K/yr,"Rating: Low

This is a low match. While Yi is a strong AI-focused Product Manager with impressive results and an MS in CS (AI), the role demands deep expertise (8+ years) in silicon design, system architecture, power/performance analysis, and hardware-centric market segments (gaming, automotive, datacenter). Yi's experience is predominantly in software AI platforms and finance, lacking the critical hardware-specific knowledge and domain experience required for this Senior Silicon and System Product Lead role.",https://www.linkedin.com/jobs/view/4332948708/
2026-02-15 17:31 UTC,4338369841,Senior Accelerated Computing Product Manager,NVIDIA,"Santa Clara, CA",10+ years,$168K/yr - $327.8K/yr,Error generating comment,https://www.linkedin.com/jobs/view/4338369841/
2026-02-15 17:31 UTC,4364753614,"Staff Product Manager, AI Runtime Data","Unity South APAC (SEA, ANZ, IND Subcont.)","San Francisco, CA (On-site)",Not specified,"$179,500",Error generating comment,https://www.linkedin.com/jobs/view/4364753614/
2026-02-15 17:31 UTC,4373297599,"Technical Product Manager – Observability (Bangkok-based, relocation provided) (Bangkok-based, relocation provided)",Agoda,"San Jose, CA (Hybrid)",3+ years,Not listed,Error generating comment,https://www.linkedin.com/jobs/view/4373297599/
2026-02-15 17:31 UTC,4312913971,Product Manager II - Base App,Coinbase,"San Francisco, CA (Remote)",5+ years,$180.4K/yr - $212.2K/yr,Error generating comment,https://www.linkedin.com/jobs/view/4312913971/
2026-02-15 17:31 UTC,4363787400,Principal Product Manager,Microsoft,United States (Remote),8+ years,$139.9K/yr - $331.2K/yr,Error generating comment,https://www.linkedin.com/jobs/view/4363787400/
2026-02-15 18:46 UTC,4372326708,Launch & Activation Manager II,OpenLoop,United States (Remote),2-5 years,Not listed,"Rating: High

This candidate is a strong match, boasting exceptional health tech/AI product experience (Commure, ChatGeneT) directly aligning with OpenLoop's domain. Their proven track record as a PM in driving user adoption, increasing revenue, and reducing churn (e.g., 150+ orgs, 50% churn reduction) directly mirrors the Launch Manager's core goals. The candidate's deep technical acumen and operational process design skills are significant strengths for understanding and adjusting SaaS configurations. The primary potential concern is the ongoing MS program's impact on full-time availability.",https://www.linkedin.com/jobs/view/4372326708/
