timestamp,job_id,job_title,company,location,experience_years,salary,comment,job_url
2026-02-12 19:12 UTC,4343133672,"Senior Product Manager, Retention",Square,San Francisco Bay Area (Remote),8+ years,"$198,000",Error generating comment,https://www.linkedin.com/jobs/view/4343133672/
2026-02-12 19:12 UTC,4327878952,Principal Product Manager - Brewing,Fellow,"San Francisco, CA (On-site)",10+ years,$190K/yr - $220K/yr,Error generating comment,https://www.linkedin.com/jobs/view/4327878952/
2026-02-12 19:12 UTC,4340949865,"Product Manager, Commerce Growth",Netflix,"Los Gatos, CA (On-site)",5+ years,$310K/yr - $545K/yr,Error generating comment,https://www.linkedin.com/jobs/view/4340949865/
2026-02-12 19:12 UTC,4343083526,"Sr. Product Manager, Content Quality Signals",Pinterest,United States (Remote),Not specified,"$139,764",Error generating comment,https://www.linkedin.com/jobs/view/4343083526/
2026-02-12 19:12 UTC,4336952176,Principal Product Manager 764,Protegrity,"Menlo Park, CA (Hybrid)",10+ years,$150K/yr,Error generating comment,https://www.linkedin.com/jobs/view/4336952176/
2026-02-12 19:12 UTC,4363395725,Segment Manager,Hyperion Materials & Technologies,United States (Remote),Not specified,Not listed,Error generating comment,https://www.linkedin.com/jobs/view/4363395725/
2026-02-12 20:43 UTC,4372150288,Product Manager,Panorama Education,United States (Remote),3+ years,$122.4K/yr - $180.1K/yr,"Rating: High

This candidate is a strong match, exceeding the 3+ years PM experience with over 5 years in complex AI/platform roles. Their deep technical fluency, MS in CS (AI), and extensive AI product experience (LLM fine-tuning, pipelines) directly align with building foundational platform capabilities for ""AI-powered product experiences."" While their direct SRE experience is less explicit, their background owning trading and enterprise AI platforms demonstrates strong technical product ownership. Short tenure at Commure is a minor flag, but overall a compelling profile.",https://www.linkedin.com/jobs/view/4372150288/
2026-02-12 20:43 UTC,4372158296,Senior Product Manager,MeeBoss,San Francisco Bay Area (On-site),5-10 years,$200K/yr - $250K/yr,Error generating comment,https://www.linkedin.com/jobs/view/4372158296/
2026-02-12 20:43 UTC,4372154362,Lead AI Product Manager,Samba TV,"San Francisco, CA (On-site)",Not specified,$187.6K/yr - $200K/yr,Error generating comment,https://www.linkedin.com/jobs/view/4372154362/
2026-02-12 20:43 UTC,4371561539,Product Manager - AI & Data Analytics,RemoteHunter,United States (Remote),Not specified,Not listed,Error generating comment,https://www.linkedin.com/jobs/view/4371561539/
2026-02-12 20:43 UTC,4182806834,Technical Product Manager - AI Solutions,Veeva Systems,United States (Remote),5+ years,$75K/yr - $165K/yr,Error generating comment,https://www.linkedin.com/jobs/view/4182806834/
2026-02-12 20:43 UTC,4345901795,Senior Product Manager,IBM,"San Jose, CA (Hybrid)",Not specified,Not listed,Error generating comment,https://www.linkedin.com/jobs/view/4345901795/
2026-02-12 20:43 UTC,4371553775,AI Product Manager,Sodali & Co,United States (Remote),5-10 years,Not listed,Error generating comment,https://www.linkedin.com/jobs/view/4371553775/
2026-02-12 20:43 UTC,4372150288,Unknown,Unknown,Unknown,Not specified,Not listed,Error generating comment,https://www.linkedin.com/jobs/view/4372150288/
2026-02-12 20:43 UTC,4372150288,Unknown,Unknown,Unknown,Not specified,Not listed,Error generating comment,https://www.linkedin.com/jobs/view/4372150288/
2026-02-12 21:40 UTC,4372153728,Product Growth Manager,9Spokes,United States (Remote),3+ years,$100K/yr - $130K/yr,Error generating comment,https://www.linkedin.com/jobs/view/4372153728/
2026-02-12 21:40 UTC,4372146961,Senior Product Manager - Estimate,Paradigm,United States (Remote),5+ years,Not listed,Error generating comment,https://www.linkedin.com/jobs/view/4372146961/
2026-02-12 21:40 UTC,4371568535,"Manager, Global Products Strategic Initiatives",Visa,"Foster City, CA (Hybrid)",3+ years,$134.6K/yr - $215.3K/yr,Error generating comment,https://www.linkedin.com/jobs/view/4371568535/
2026-02-12 21:40 UTC,4362188411,Senior Product Manager,Weee!,"Fremont, CA (On-site)",6+ years,$151.5K/yr - $178K/yr,Error generating comment,https://www.linkedin.com/jobs/view/4362188411/
2026-02-12 21:40 UTC,4371562331,Senior Product Manager – Identity & Enterprise Security Platforms,Verastro,United States (Remote),5+ years,Not listed,Error generating comment,https://www.linkedin.com/jobs/view/4371562331/
2026-02-12 21:40 UTC,4365318729,Senior Product Manager,Guild,United States (Remote),8+ years,$190K/yr,Error generating comment,https://www.linkedin.com/jobs/view/4365318729/
2026-02-12 21:40 UTC,4363955069,EWM Functional Product Manager,Aptimized,United States (Remote),8+ years,$1/yr - $2/yr,Error generating comment,https://www.linkedin.com/jobs/view/4363955069/
2026-02-12 21:40 UTC,4372153728,Unknown,Unknown,Unknown,Not specified,Not listed,Error generating comment,https://www.linkedin.com/jobs/view/4372153728/
2026-02-12 21:40 UTC,4372153728,Unknown,Unknown,Unknown,Not specified,Not listed,Error generating comment,https://www.linkedin.com/jobs/view/4372153728/
2026-02-12 22:39 UTC,4363984301,Product Mgmt/Strategy Snr Manager-ProdDev,Oracle,"Santa Clara, CA (On-site)",Not specified,$120.1K/yr - $251.6K/yr,"Rating: Medium

Yi brings exceptional AI/ML product leadership and a strong track record of quantifiable impact in enterprise settings, highly relevant to OCI's AI-focused services and strategic customers. However, the resume lacks explicit people management experience, a critical requirement for an M3/Director role focused on leading a team and providing mentorship. Familiarity with data center architecture and hardware deployments also isn't explicitly highlighted.",https://www.linkedin.com/jobs/view/4363984301/
2026-02-12 22:39 UTC,4371578094,Product Manager,Welocalize,United States (Remote),25+ years,Not listed,"Rating: High

This candidate is a strong match, boasting extensive AI/LLM product management experience with quantifiable results in enterprise settings. Their expertise in LLM fine-tuning, AI pipeline development, and data strategy, combined with an MS in AI, directly aligns with Welocalize's focus on enhancing AI models and state-of-the-art practices. Strengths include a strong academic background, proven leadership in complex AI platforms, and a results-driven approach. A minor gap is direct experience managing large-scale data annotation worker operations platforms, but their ""human-in-the-loop"" and enterprise PM background provides solid transferability.",https://www.linkedin.com/jobs/view/4371578094/
2026-02-12 22:39 UTC,4363906149,Product Manager,Empower Professionals Inc - Talent & IT Services,"San Jose, CA (Hybrid)",10+ years,Not listed,Error generating comment,https://www.linkedin.com/jobs/view/4363906149/
2026-02-12 22:39 UTC,4372168167,Product Operations Manager,Notion,"San Francisco, CA (Hybrid)",4+ years,$140K/yr - $190K/yr,Error generating comment,https://www.linkedin.com/jobs/view/4372168167/
2026-02-12 22:39 UTC,4372165545,Senior Product Manager - Behavioral Analytics,Socure,United States (Remote),5+ years,$170K/yr - $205K/yr,Error generating comment,https://www.linkedin.com/jobs/view/4372165545/
2026-02-12 22:39 UTC,4362587558,"Senior Product Manager, Advertising",Wurl,United States (Remote),5+ years,$161K/yr - $241K/yr,Error generating comment,https://www.linkedin.com/jobs/view/4362587558/
2026-02-12 22:39 UTC,4372149934,Product Content Manager,Openly,United States (Remote),6+ years,$93.6K/yr - $156K/yr,Error generating comment,https://www.linkedin.com/jobs/view/4372149934/
2026-02-12 23:36 UTC,4365325553,Senior Product Manager,Guild,United States (Remote),5+ years,$190K/yr,Error generating comment,https://www.linkedin.com/jobs/view/4365325553/
2026-02-12 23:36 UTC,4355050987,"Staff Product Manager, Business",Linktree,United States (Remote),7+ years,$215K/yr - $230K/yr,Error generating comment,https://www.linkedin.com/jobs/view/4355050987/
2026-02-12 23:36 UTC,4371594013,Technical AI Product Manager Global/Remote,CryptoCurrency ICO/Airdrop,United States (Remote),Not specified,Not listed,Error generating comment,https://www.linkedin.com/jobs/view/4371594013/
2026-02-12 23:36 UTC,4371582172,Product Manager (Early Career),Jobright.ai,United States (Remote),0-2 years,Not listed,Error generating comment,https://www.linkedin.com/jobs/view/4371582172/
2026-02-12 23:36 UTC,4371580153,"Data Product Manager, CCO (Remote)",ezCater,United States (Remote),2+ years,$133K/yr - $174K/yr,Error generating comment,https://www.linkedin.com/jobs/view/4371580153/
2026-02-12 23:36 UTC,4372158913,Senior Product Manager - Consumer,StyleSeat,"San Francisco, CA (Remote)",5+ years,$152.7K/yr - $180.9K/yr,Error generating comment,https://www.linkedin.com/jobs/view/4372158913/
2026-02-13 02:33 UTC,4356123488,Product Manager - HashiCorp,IBM,"San Jose, CA (Hybrid)",Not specified,Not listed,"Rating: High

Emma is an exceptional match, boasting deep AI Product Manager experience, particularly with LLMs, fine-tuning, and driving significant business impact in enterprise settings (healthcare, finance). Her technical acumen, roadmap development, and product ownership skills align perfectly with the role's requirements and IBM's focus on AI-powered solutions. Key strengths include her strong quantifiable achievements and current MS in AI. The main potential gap is specific HashiCorp product experience, and her graduation in Dec 2025 might affect immediate availability for a full-time role.",https://www.linkedin.com/jobs/view/4356123488/
2026-02-13 02:33 UTC,4350177913,Sr. Product Manager - HashiCorp Boundary,IBM,"San Jose, CA (Hybrid)",8+ years,Not listed,Error generating comment,https://www.linkedin.com/jobs/view/4350177913/
2026-02-13 02:33 UTC,4356501709,Senior Product Manager,IBM,"San Jose, CA (Hybrid)",8+ years,Not listed,Error generating comment,https://www.linkedin.com/jobs/view/4356501709/
2026-02-13 02:33 UTC,4356481745,Product Manager,IBM,"San Jose, CA (Hybrid)",5+ years,Not listed,Error generating comment,https://www.linkedin.com/jobs/view/4356481745/
2026-02-13 02:33 UTC,4355965930,Product Manager - HashiCorp AI Security,IBM,"San Jose, CA (Hybrid)",Not specified,Not listed,Error generating comment,https://www.linkedin.com/jobs/view/4355965930/
2026-02-13 02:33 UTC,4350752136,Product Manager,IBM,"San Jose, CA (Hybrid)",1+ years,Not listed,Error generating comment,https://www.linkedin.com/jobs/view/4350752136/
2026-02-13 04:56 UTC,4363975974,Product Growth Lead,Lemurian Labs,"Santa Clara, CA",8+ years,Not listed,"Rating: Medium

Emma is a strong AI Product Manager with impressive results in driving growth, revenue, and adoption across various industries, demonstrating deep technical skills in LLMs and AI pipelines. However, she falls short of the ""8+ years hybrid background"" requirement, particularly in dedicated Developer Relations or Solutions Engineering roles. Her resume also doesn't explicitly showcase the niche HPC/compiler technical fluency or a portfolio of technical writing as outlined, which are crucial for this deeply technical, developer-focused growth role.",https://www.linkedin.com/jobs/view/4363975974/
2026-02-13 04:56 UTC,4371722793,Senior Product Manager,Stitch Fix,United States (Remote),8+ years,$145.1K/yr - $242K/yr,Error generating comment,https://www.linkedin.com/jobs/view/4371722793/
2026-02-13 04:56 UTC,4362586632,"Product Manager, Google Store, Growth",Google,"Mountain View, CA (On-site)",5+ years,$156K/yr - $229K/yr,Error generating comment,https://www.linkedin.com/jobs/view/4362586632/
2026-02-13 04:56 UTC,4320908102,"Product Manager, Synthetics",Kentik,United States (Remote),5+ years,$160K/yr - $180K/yr,Error generating comment,https://www.linkedin.com/jobs/view/4320908102/
2026-02-13 04:56 UTC,4364402297,"Product Manager, LangSmith",LangChain,"San Francisco, CA (On-site)",3+ years,$180K/yr - $215K/yr,Error generating comment,https://www.linkedin.com/jobs/view/4364402297/
2026-02-13 04:56 UTC,4371722661,Staff Product Manager - Data Platform,Intuit,"Mountain View, CA",5+ years,$180.5K/yr - $244K/yr,Error generating comment,https://www.linkedin.com/jobs/view/4371722661/
2026-02-13 04:56 UTC,4371719711,"Senior Product Manager, Accountant Experiences",Intuit,"Mountain View, CA (On-site)",3-5 years,$146.5K/yr - $210.5K/yr,Error generating comment,https://www.linkedin.com/jobs/view/4371719711/
2026-02-13 06:03 UTC,4364450672,"Principal Product Manager, YouTube Music and Media Payments",Google,"San Bruno, CA (On-site)",15+ years,$272K/yr - $383K/yr,Error generating comment,https://www.linkedin.com/jobs/view/4364450672/
2026-02-13 06:03 UTC,4354227122,"Product Manager, Trusted Execution Environments (Ads Platform)",Netflix,"Los Gatos, CA (On-site)",10+ years,$310K/yr - $545K/yr,Error generating comment,https://www.linkedin.com/jobs/view/4354227122/
2026-02-13 06:03 UTC,4371741025,"Senior Manager, Product Analytics",Strava,"San Francisco, CA (Hybrid)",4+ years,$250K/yr - $285K/yr,Error generating comment,https://www.linkedin.com/jobs/view/4371741025/
2026-02-13 06:03 UTC,search,Unknown,GMI Cloud,"Mountain View, CA (Hybrid)",5+ years,Not listed,Error generating comment,https://www.linkedin.com/jobs/view/search/
2026-02-13 06:03 UTC,search,Unknown,Scale AI,San Francisco Bay Area (Hybrid),Not specified,Not listed,Error generating comment,https://www.linkedin.com/jobs/view/search/
2026-02-13 06:03 UTC,search,Unknown,VySystems,San Francisco Bay Area (Hybrid),Not specified,Not listed,Error generating comment,https://www.linkedin.com/jobs/view/search/
2026-02-13 06:03 UTC,search,Unknown,Harvey,"Dallas, TX (Hybrid)",Not specified,$160K/yr - $185K/yr,Error generating comment,https://www.linkedin.com/jobs/view/search/
2026-02-13 06:03 UTC,search,Unknown,Harvey,"San Francisco, CA (Hybrid)",Not specified,$220K/yr - $260K/yr,Error generating comment,https://www.linkedin.com/jobs/view/search/
2026-02-13 06:03 UTC,search,Unknown,Harvey,"Dallas, TX (Hybrid)",Not specified,$210K/yr - $240K/yr,Error generating comment,https://www.linkedin.com/jobs/view/search/
2026-02-13 06:03 UTC,search,Unknown,micro1,United States (Remote),Not specified,$110K/yr - $140K/yr,Error generating comment,https://www.linkedin.com/jobs/view/search/
2026-02-13 06:03 UTC,search,Unknown,Mercor,United States (Remote),Not specified,$100,Error generating comment,https://www.linkedin.com/jobs/view/search/
2026-02-13 06:03 UTC,search,Unknown,Jobright.ai,United States (Remote),Not specified,Not listed,Error generating comment,https://www.linkedin.com/jobs/view/search/
2026-02-13 06:03 UTC,search,Unknown,New Port LLC,"Redwood City, CA (On-site)",Not specified,$96K/yr - $180K/yr,Error generating comment,https://www.linkedin.com/jobs/view/search/
2026-02-13 06:03 UTC,search,Unknown,Indotronix International Corporation,"Columbus, OH (On-site)",Not specified,Not listed,Error generating comment,https://www.linkedin.com/jobs/view/search/
2026-02-13 06:03 UTC,search,Unknown,Commure,"Mountain View, CA (On-site)",Not specified,$120K/yr - $150K/yr,Error generating comment,https://www.linkedin.com/jobs/view/search/
2026-02-13 14:39 UTC,4343276960,"Product Manager, Developer Experience & Tools",Early Warning®,"San Francisco, CA (Hybrid)",5+ years,$106K/yr - $156K/yr,"Rating: Medium

This candidate offers strong AI/ML Product Management experience with significant quantifiable impact in the financial sector, aligning well with Early Warning's domain and technical needs. Key strengths include deep AI expertise, technical understanding, and enterprise platform delivery. However, there's a notable gap in explicit Developer Experience, developer-facing tools, and documentation platform ownership, which are core to this role. The candidate's ongoing Master's program (Sep 2024–Dec 2025) also indicates unavailability for an immediate full-time position, a critical practical mismatch.",https://www.linkedin.com/jobs/view/4343276960/
2026-02-13 14:39 UTC,4364185091,Senior Product Manager,Cybotic System,"San Jose, CA (On-site)",5+ years,Not listed,"Rating: Low

This candidate has strong product management skills and relevant AI/ML software experience, but it's a poor match due to a critical lack of hardware domain expertise. The role requires deep knowledge in data center switching hardware, Broadcom ASICs, CPO, thermal design, and hardware lifecycle management, none of which are evident. While their AI experience touches on AI workloads, it's from a software perspective, not the required infrastructure hardware.",https://www.linkedin.com/jobs/view/4364185091/
2026-02-13 14:39 UTC,4372732231,Technical Product Manager- Keystone,NetApp,"San Jose, CA (Remote)",8-12 years,$183.6K/yr - $272.8K/yr,"Rating: Medium

Emma boasts exceptional AI/ML product management skills, directly matching the job's need for data-driven sizing and recommendation engines, and showcasing a strong technical background. Her enterprise PM experience and proven impact on revenue/churn are also strengths. However, she lacks direct domain expertise in Storage-as-a-Service (STaaS), cloud infrastructure, or hardware lifecycle management, which are central to this NetApp role. This gap could hinder her ability to immediately contribute to core platform strategy and execution.",https://www.linkedin.com/jobs/view/4372732231/
2026-02-13 14:39 UTC,4372734030,Digital Product Sr Manager,Amgen,United States (Remote),Not specified,Not listed,"Rating: High

This is a high match due to the candidate's exceptional and highly relevant AI Product Manager experience, particularly in healthcare AI (Commure, ChatGeneT). Their direct experience fine-tuning LLMs, building AI pipelines, and demonstrating significant business impact (revenue, churn, denials reduction) aligns perfectly with Amgen's focus on AI adoption, AI-native PDLC, and integrating AI for efficiency and user impact. While their total PM tenure (~5 years) might be slightly light for a ""Senior Manager,"" their specialized expertise and quantifiable results make them an extremely strong candidate for this AI-heavy digital transformation role.",https://www.linkedin.com/jobs/view/4372734030/
2026-02-13 14:39 UTC,4364433627,Product Specialist - Integration,Surgical Information Systems,United States (Remote),7+ years,Not listed,"Rating: High

This is an excellent match due to the candidate's direct healthcare AI product experience (Commure, ChatGeneT), deep technical background in LLMs/data pipelines, and proven ability to drive significant results. Their work on CPT/ICD codes and patient simulators aligns perfectly with healthcare data integration and utilization. While previous roles weren't titled ""Integration,"" their project experience directly involves building complex data systems crucial for this role. A potential minor gap is shorter healthcare PM duration, but the relevance is exceptionally high.",https://www.linkedin.com/jobs/view/4364433627/
2026-02-13 14:39 UTC,4326883007,"Lead Product Manager, Data & A.I",Pebl,"Palo Alto, CA (Hybrid)",12+ years,$176K/yr,"Rating: High

This candidate is an excellent match due to their deep and current AI/ML product leadership, specifically with LLMs and data platforms. They demonstrate quantifiable impact, strong technical skills (fine-tuning, LangChain, PyTorch), and relevant academic background. While their total PM tenure (~5 years) for a ""Lead"" role is on the lower end, their rapid progression and significant achievements could offset this. A minor gap is direct domain experience in global HR/payroll.",https://www.linkedin.com/jobs/view/4326883007/
2026-02-13 14:39 UTC,4326795810,Product Manager (API Developer Experience) - Remote,Availity,United States (Remote),5+ years,$250,"Rating: Medium

This candidate is a good match for technical depth, enterprise platform experience, and relevant healthcare AI exposure (Commure, ChatGeneT) with strong, quantifiable results. However, she significantly misses the ""minimum of 5 years’ experience in Product Management within healthcare IT"" requirement, having only ~6 months. While her general PM skills are strong, specific experience building API developer portals and tools is not explicitly highlighted.",https://www.linkedin.com/jobs/view/4326795810/
2026-02-13 15:52 UTC,4372741244,"Product Manager, TuneLab Platform",BioSpace,"San Francisco, CA",5+ years,$145.5K/yr - $213.4K/yr,"Rating: High

This candidate is an excellent match due to deep expertise in AI/ML product management, including LLM fine-tuning and end-to-end AI pipeline development. Her healthcare domain experience (Commure, ChatGeneT) and proven ability to scale AI products with significant business impact are highly relevant. She brings the required technical acumen (MS CS AI). The main gap is a lack of explicit *computational drug discovery* experience, though her technical foundation should bridge this. Short tenure at Commure and current MS enrollment might need clarification regarding availability.",https://www.linkedin.com/jobs/view/4372741244/
2026-02-13 15:52 UTC,4311735801,"Staff Product Manager, Ads Ranking",Snap Inc.,"Palo Alto, CA",8+ years,$195K/yr - $343K/yr,"Rating: High

Analysis: This candidate is an excellent match due to deep, quantified experience in AI/ML product management, especially LLM fine-tuning and building data-driven platforms that significantly boost revenue and efficiency. Their strong analytical skills and ability to translate business needs into ML solutions directly align with leading ads ranking. While their experience is in enterprise rather than consumer advertising, the core technical and strategic leadership required for ML-driven product development is exceptionally strong, making them a compelling candidate despite the domain shift. Experience level is at the lower end for Staff, but accomplishments are stellar.",https://www.linkedin.com/jobs/view/4311735801/
2026-02-13 15:52 UTC,4349670360,Senior Product Manager - The Sims,Electronic Arts (EA),"Redwood City, CA (Hybrid)",Not specified,"$91,100 - $126,900","Rating: Low

This candidate has strong analytical, AI, and general PM skills, with a track record of driving significant business outcomes and just meets the 5 years PM experience. However, the critical weakness is a complete lack of experience in the gaming industry, specifically launching or optimizing gameplay features for a large title. Passion for games is also unaddressed. While the data analysis skills are excellent, the core domain expertise and understanding of game development for a Senior PM role are missing.",https://www.linkedin.com/jobs/view/4349670360/
2026-02-13 15:52 UTC,4311224730,"Staff Product Manager, Agentic Offensive Security",HackerOne,San Francisco Bay Area (Remote),8+ years,$238K/yr - $291K/yr,"Rating: Medium

Emma's deep expertise in GenAI/LLM fine-tuning, AI pipeline development, and proven track record of driving significant business impact with enterprise AI platforms are exceptional strengths. Her technical skills and experience building agentic-like systems directly align with the role's core GenAI/LLM requirement. However, a critical gap is the complete lack of cybersecurity or offensive security domain experience, which is central to HackerOne's mission and this specialized Staff-level position. While AI skills are strong, the absence of security knowledge poses a significant challenge for this role.",https://www.linkedin.com/jobs/view/4311224730/
2026-02-13 15:52 UTC,4280985677,"Product Lead, Finance Products",Rippling,"San Francisco, CA (On-site)",5+ years,$144K/yr - $252K/yr,"Rating: High

This is a strong match. Yi brings deep financial domain expertise from JPMorgan and Société Générale, proven impact scaling platforms, and impressive quantifiable results. Her strong technical acumen, including AI/ML skills, positions her well for complex platform-level challenges at Rippling. While direct experience in payroll/HR finance products isn't explicit, her payment processing and enterprise platform background is highly transferable. The short tenure at Commure is the main minor concern.",https://www.linkedin.com/jobs/view/4280985677/
2026-02-13 15:52 UTC,4372736519,MarTech Product Manager – AEP,Infojini Inc,United States (Remote),Not specified,Not listed,"Rating: Medium

**Analysis:**
Emma is a highly accomplished AI Product Manager with deep technical expertise, a proven track record in building and scaling complex AI/data platforms, and strong business impact. However, the role is heavily focused on Adobe Experience Platform (AEP) and the MarTech domain, for which the candidate has no direct experience (AEP, AJO, CJA). While her general PM, data strategy, and AI skills are highly transferable, the lack of specific AEP ownership experience for this central platform role is a significant gap.",https://www.linkedin.com/jobs/view/4372736519/
2026-02-13 15:52 UTC,4372727924,"Product Manager II, Mobility Marketplace",Uber,"San Francisco, CA (On-site)",3+ years,$161K/yr - $179K/yr,"Rating: High

This is a strong match. The candidate offers exceptional AI/ML technical depth, a robust quantitative background (CS AI MS, Math of Finance MA), and a proven track record of shipping ML-driven products with significant impact and optimization. While direct mobility marketplace experience is absent, their success in algorithm-heavy financial platforms and enterprise AI demonstrates highly transferable skills. The core requirements for a highly technical PM in ML-driven optimization are met exceptionally well.",https://www.linkedin.com/jobs/view/4372727924/
